{"authority":["synthetic fixture reviewer"],"bindings":[{"claim_id":"accuracy-reported","evidence_id":"sample-accuracy","role":"supports"}],"claims":[{"claim_id":"accuracy-reported","element_ref":{"component_id":"results","element_id":"accuracy"},"material":true,"rationale":"Synthetic reviewer matched the statement to the source line.","statement":"The stored sample reports accuracy 0.91.","status":"supported"}],"evidence_items":[{"evidence_id":"sample-accuracy","locator":{"end":1,"kind":"line_range","start":1},"method":"inspected","observed_summary":"The stored sample reports accuracy 0.91.","source":{"kind":"file","path":"evidence/support.txt"}}],"limitations":[],"objective":"Inspect a synthetic accuracy statement.","schema_version":"2.0","scope":["evidence/support.txt"],"summary":{"claim_boundary_ids":[],"no_supported_claim":false,"strongest_safe_claim_id":"accuracy-reported"},"unresolved_uncertainties":["Synthetic example does not establish held-out accuracy."]}
